Object Type,Object Name,Corresponding Steps,Predecessor,Successor,Input Data,Input Data Assesment,Output Data,Output Data Assesment,Additional Information
Start Event,Start Review Cycle,,N/A,Receive Plenary Minutes,N/A,,N/A,,
Receive Task,Receive Plenary Minutes,4_6.3,Start Review Cycle,Review Decision,N/A,,Plenary Minutes,TP,
Gateway (Exclusive),Review Decision,4_6.3,Receive Plenary Minutes,Send Archival Request (Archive) OR Review Completed (Keep),,,,,
Send Task,Send Archival Request,4_6.3,Review Decision,Review Completed,Plenary Minutes,Tp,Archive Request Email,TP,SMU Secretariat to send e-mail to repository mailbox to inform repository manager of request to archive
End Event,Review Completed,,Send Archival Request OR Review Decision,N/A,N/A,,N/A,,